{
  "schema_version": "1.0",
  "name": "Immediate 9 bar (pre-infusion comparison case)",
  "puck": {
    "dose_g": 18.0,
    "basket_diameter_mm": 58.0,
    "depth_mm": 9.0,
    "particle_diameter_um": 330.0,
    "particle_spread_factor": 0.5
  },
  "pressure_profile_bar": [[0, 9], [30, 9]],
  "temperature_profile_c": [[0, 94], [30, 92]],
  "stop": { "target_beverage_g": 36, "maximum_time_s": 50 }
}
