{
  "schema_version": "1.0",
  "name": "Gaggia Classic Pro E24 18 g double - fine grind",
  "puck": {
    "dose_g": 18.0,
    "basket_diameter_mm": 58.0,
    "depth_mm": 9.0,
    "particle_diameter_um": 330.0,
    "particle_spread_factor": 0.55
  },
  "pressure_profile_bar": [[0, 9], [45, 9]],
  "temperature_profile_c": [[0, 93]],
  "stop": { "target_beverage_g": 36, "maximum_time_s": 50 }
}
