{
  "schema_version": "1.0",
  "name": "Two-region channelled puck",
  "puck": {
    "dose_g": 18.0,
    "basket_diameter_mm": 58.0,
    "depth_mm": 9.0,
    "particle_diameter_um": 350.0,
    "particle_spread_factor": 0.55
  },
  "parallel_regions": [
    { "area_fraction": 0.8, "permeability_multiplier": 0.7 },
    { "area_fraction": 0.2, "permeability_multiplier": 4.0 }
  ],
  "pressure_profile_bar": [[0, 2], [6, 2], [10, 9], [30, 9]],
  "temperature_profile_c": [[0, 93]],
  "stop": { "target_beverage_g": 36, "maximum_time_s": 45 }
}
